{
  "tvf": "1",
  "id": "core",
  "version": "1.0.0",
  "chains": [
    1,
    4663
  ],
  "subject": {
    "token": "address",
    "pool": "PoolRef"
  },
  "checks": [
    {
      "id": "code.unverified",
      "category": "code",
      "fact": "The source code of {token} on {chain} is not verified, or {token} is a proxy whose current implementation's source code is not verified (see verified, proxy).",
      "definitions": {
        "verified": "Verified means the explorer shows an exact or partial source match: etherscan.io on Ethereum mainnet, robinhoodchain.blockscout.com on Robinhood Chain, or sourcify.dev on either chain.",
        "proxy": "A proxy is a contract whose EIP-1967 implementation slot (0x360894a13ba1a3210667c828492db98dca3e2076cc3735a920a3ca505d382bbc) or EIP-1967 beacon slot (0xa3f0ad74e5423aebfd80d3ef4346578335a9a72aeaee59ff6cb3582b35133d50) is non-zero, or whose runtime code is an EIP-1167 minimal proxy. Its current implementation is the address that the slot, the beacon or the EIP-1167 code points to."
      },
      "sources": [
        "https://etherscan.io/",
        "https://robinhoodchain.blockscout.com/",
        "https://sourcify.dev/",
        "https://repo.sourcify.dev/"
      ],
      "riskIf": true,
      "severity": "high",
      "window": {
        "hours": 24
      }
    },
    {
      "id": "code.proxy",
      "category": "code",
      "fact": "{token} on {chain} is a proxy (see proxy).",
      "definitions": {
        "proxy": "A proxy is a contract whose EIP-1967 implementation slot (0x360894a13ba1a3210667c828492db98dca3e2076cc3735a920a3ca505d382bbc) or EIP-1967 beacon slot (0xa3f0ad74e5423aebfd80d3ef4346578335a9a72aeaee59ff6cb3582b35133d50) is non-zero, or whose runtime code is an EIP-1167 minimal proxy. Its current implementation is the address that the slot, the beacon or the EIP-1167 code points to."
      },
      "sources": [
        "https://etherscan.io/",
        "https://robinhoodchain.blockscout.com/",
        "https://sourcify.dev/",
        "https://repo.sourcify.dev/"
      ],
      "riskIf": true,
      "severity": "medium",
      "window": {
        "hours": 24
      }
    },
    {
      "id": "code.proxy_unverified_impl",
      "category": "code",
      "fact": "{token} on {chain} is a proxy (see proxy) and the source code of its current implementation is not verified (see verified).",
      "definitions": {
        "verified": "Verified means the explorer shows an exact or partial source match: etherscan.io on Ethereum mainnet, robinhoodchain.blockscout.com on Robinhood Chain, or sourcify.dev on either chain.",
        "proxy": "A proxy is a contract whose EIP-1967 implementation slot (0x360894a13ba1a3210667c828492db98dca3e2076cc3735a920a3ca505d382bbc) or EIP-1967 beacon slot (0xa3f0ad74e5423aebfd80d3ef4346578335a9a72aeaee59ff6cb3582b35133d50) is non-zero, or whose runtime code is an EIP-1167 minimal proxy. Its current implementation is the address that the slot, the beacon or the EIP-1167 code points to."
      },
      "sources": [
        "https://etherscan.io/",
        "https://robinhoodchain.blockscout.com/",
        "https://sourcify.dev/",
        "https://repo.sourcify.dev/"
      ],
      "riskIf": true,
      "severity": "critical",
      "window": {
        "hours": 24
      }
    },
    {
      "id": "code.selfdestruct",
      "category": "code",
      "fact": "The code of {token} on {chain}, or of its current implementation if it is a proxy, has a reachable SELFDESTRUCT, or a reachable DELEGATECALL whose target a caller or a role can choose (see reachable, role).",
      "definitions": {
        "reachable": "Reachable means some external or public function, possibly behind an access check, can execute the opcode in the token's own context. A proxy forwarding calls to its current implementation does not count.",
        "proxy": "A proxy is a contract whose EIP-1967 implementation slot (0x360894a13ba1a3210667c828492db98dca3e2076cc3735a920a3ca505d382bbc) or EIP-1967 beacon slot (0xa3f0ad74e5423aebfd80d3ef4346578335a9a72aeaee59ff6cb3582b35133d50) is non-zero, or whose runtime code is an EIP-1167 minimal proxy. Its current implementation is the address that the slot, the beacon or the EIP-1167 code points to.",
        "role": "A role is any address, or holder of an access-control role, that can call a restricted function of the token or its current implementation at the window closing block. Owners are roles. A role with no holder, or held only by a renounced address, does not count."
      },
      "sources": [
        "https://etherscan.io/",
        "https://robinhoodchain.blockscout.com/",
        "https://sourcify.dev/",
        "https://repo.sourcify.dev/"
      ],
      "riskIf": true,
      "severity": "high",
      "window": {
        "hours": 24
      }
    },
    {
      "id": "control.owner_active",
      "category": "control",
      "fact": "{token} on {chain} has an owner that is not renounced (see owner).",
      "definitions": {
        "owner": "The owner is the address returned at the window closing block by the first of owner() or getOwner() that the token or its implementation implements, else any holder of DEFAULT_ADMIN_ROLE (0x00). A proxy's EIP-1967 admin (slot 0xb53127684a568b3173ae13b9f8a6016e243e63b6e8ee1178d6a717850b5d6103) is also an owner. An owner of 0x0 or 0x000000000000000000000000000000000000dEaD is renounced."
      },
      "sources": [
        "https://etherscan.io/",
        "https://robinhoodchain.blockscout.com/"
      ],
      "riskIf": true,
      "severity": "low",
      "window": {
        "hours": 24
      }
    },
    {
      "id": "control.admin_is_eoa",
      "category": "control",
      "fact": "An owner of {token} on {chain} that is not renounced is an EOA, or is a contract that can act with a timelock delay shorter than {param.delay}; no timelock counts as zero (see owner).",
      "params": {
        "delay": {
          "type": "days",
          "default": 1,
          "min": 0,
          "max": 30
        }
      },
      "definitions": {
        "owner": "The owner is the address returned at the window closing block by the first of owner() or getOwner() that the token or its implementation implements, else any holder of DEFAULT_ADMIN_ROLE (0x00). A proxy's EIP-1967 admin (slot 0xb53127684a568b3173ae13b9f8a6016e243e63b6e8ee1178d6a717850b5d6103) is also an owner. An owner of 0x0 or 0x000000000000000000000000000000000000dEaD is renounced."
      },
      "sources": [
        "https://etherscan.io/",
        "https://robinhoodchain.blockscout.com/"
      ],
      "riskIf": true,
      "severity": "high",
      "window": {
        "hours": 24
      }
    },
    {
      "id": "control.hidden_owner",
      "category": "control",
      "fact": "Some address that is not an owner of {token} on {chain} holds a privileged role (see owner, privileged).",
      "definitions": {
        "owner": "The owner is the address returned at the window closing block by the first of owner() or getOwner() that the token or its implementation implements, else any holder of DEFAULT_ADMIN_ROLE (0x00). A proxy's EIP-1967 admin (slot 0xb53127684a568b3173ae13b9f8a6016e243e63b6e8ee1178d6a717850b5d6103) is also an owner. An owner of 0x0 or 0x000000000000000000000000000000000000dEaD is renounced.",
        "role": "A role is any address, or holder of an access-control role, that can call a restricted function of the token or its current implementation at the window closing block. Owners are roles. A role with no holder, or held only by a renounced address, does not count.",
        "privileged": "A privileged role is a role that can mint, pause transfers, block addresses, set taxes or change holder balances of the token."
      },
      "sources": [
        "https://etherscan.io/",
        "https://robinhoodchain.blockscout.com/"
      ],
      "riskIf": true,
      "severity": "high",
      "window": {
        "hours": 24
      }
    },
    {
      "id": "control.mintable",
      "category": "control",
      "fact": "Some address can increase the totalSupply of {token} on {chain} by calling a function of its current code.",
      "definitions": {},
      "sources": [
        "https://etherscan.io/",
        "https://robinhoodchain.blockscout.com/",
        "https://sourcify.dev/",
        "https://repo.sourcify.dev/"
      ],
      "riskIf": true,
      "severity": "high",
      "window": {
        "hours": 24
      }
    },
    {
      "id": "control.change_balance",
      "category": "control",
      "fact": "A role can reduce, burn or overwrite the balance of an arbitrary holder of {token} on {chain} without that holder's approval (see role).",
      "definitions": {
        "role": "A role is any address, or holder of an access-control role, that can call a restricted function of the token or its current implementation at the window closing block. Owners are roles. A role with no holder, or held only by a renounced address, does not count."
      },
      "sources": [
        "https://etherscan.io/",
        "https://robinhoodchain.blockscout.com/",
        "https://sourcify.dev/",
        "https://repo.sourcify.dev/"
      ],
      "riskIf": true,
      "severity": "critical",
      "window": {
        "hours": 24
      }
    },
    {
      "id": "control.pausable",
      "category": "control",
      "fact": "A role can pause or block all transfers of {token} on {chain} (see role).",
      "definitions": {
        "role": "A role is any address, or holder of an access-control role, that can call a restricted function of the token or its current implementation at the window closing block. Owners are roles. A role with no holder, or held only by a renounced address, does not count."
      },
      "sources": [
        "https://etherscan.io/",
        "https://robinhoodchain.blockscout.com/",
        "https://sourcify.dev/",
        "https://repo.sourcify.dev/"
      ],
      "riskIf": true,